[
  {
    "Id": "statline_569",
    "Name": "Mortar",
    "Type": "Statline",
    "Attributes": {
      "M": "-",
      "WS": "-",
      "BS": "-",
      "S": "-",
      "T": "7",
      "W": "3",
      "I": "-",
      "A": "-",
      "Ld": "-"
    },
    "Children": [
      {
        "Id": "2115-8098-83e9-ead7"
      }
    ]
  },
  {
    "Id": "statline_570",
    "Name": "Gun Crew",
    "Type": "Statline",
    "Attributes": {
      "M": "4",
      "WS": "3",
      "BS": "3",
      "S": "3",
      "T": "3",
      "W": "3",
      "I": "3",
      "A": "3",
      "Ld": "7"
    },
    "Children": [
      {
        "Id": "6d4a-7733-d725-a267"
      }
    ]
  },
  {
    "Id": "statline_571",
    "Name": "Organ Gun",
    "Type": "Statline",
    "Attributes": {
      "M": "-",
      "WS": "-",
      "BS": "-",
      "S": "-",
      "T": "7",
      "W": "3",
      "I": "-",
      "A": "-",
      "Ld": "-"
    },
    "Children": [
      {
        "Id": "5635-efd8-13b6-c841"
      }
    ]
  },
  {
    "Id": "statline_572",
    "Name": "Hireling Outrider",
    "Type": "Statline",
    "Attributes": {
      "M": "-",
      "WS": "3",
      "BS": "3",
      "S": "3",
      "T": "3",
      "W": "1",
      "I": "3",
      "A": "1",
      "Ld": "7"
    },
    "Children": [
      {
        "Id": "6d4a-7733-d725-a267"
      }
    ]
  },
  {
    "Id": "statline_573",
    "Name": "Hireling Outrider",
    "Type": "Statline",
    "Attributes": {
      "M": "-",
      "WS": "3",
      "BS": "4",
      "S": "3",
      "T": "3",
      "W": "1",
      "I": "3",
      "A": "1",
      "Ld": "7"
    },
    "Children": [
      {
        "Id": "6d4a-7733-d725-a267"
      }
    ]
  },
  {
    "Id": "statline_574",
    "Name": "Veteran Freeblade",
    "Type": "Statline",
    "Attributes": {
      "M": "-",
      "WS": "4",
      "BS": "3",
      "S": "4",
      "T": "3",
      "W": "1",
      "I": "3",
      "A": "1",
      "Ld": "8"
    },
    "Children": [
      {
        "Id": "6d4a-7733-d725-a267"
      },
      {
        "Id": "c56e-8d1b-bb4-de99"
      }
    ]
  },
  {
    "Id": "statline_575",
    "Name": "Commander (Freeblade Knight)",
    "Type": "Statline",
    "Attributes": {
      "M": "-",
      "WS": "4",
      "BS": "3",
      "S": "3",
      "T": "3",
      "W": "1",
      "I": "3",
      "A": "2",
      "Ld": "8"
    },
    "Children": [
      {
        "Id": "6d4a-7733-d725-a267"
      },
      {
        "Id": "c56e-8d1b-bb4-de99"
      }
    ]
  },
  {
    "Id": "statline_576",
    "Name": "Warhorses",
    "Type": "Statline",
    "Attributes": {
      "M": "8",
      "WS": "3",
      "BS": "-",
      "S": "3",
      "T": "-",
      "W": "-",
      "I": "3",
      "A": "1",
      "Ld": "-"
    },
    "Children": [
      {
        "Id": "6d4a-7733-d725-a267"
      }
    ]
  },
  {
    "Id": "statline_577",
    "Name": "Freeblade Knights",
    "Type": "Statline",
    "Attributes": {
      "M": "-",
      "WS": "4",
      "BS": "3",
      "S": "3",
      "T": "3",
      "W": "1",
      "I": "3",
      "A": "1",
      "Ld": "8"
    },
    "Children": [
      {
        "Id": "6d4a-7733-d725-a267"
      },
      {
        "Id": "c56e-8d1b-bb4-de99"
      }
    ]
  },
  {
    "Id": "statline_578",
    "Name": "Sellswords",
    "Type": "Statline",
    "Attributes": {
      "M": "4",
      "WS": "3",
      "BS": "3",
      "S": "3",
      "T": "3",
      "W": "1",
      "I": "3",
      "A": "1",
      "Ld": "5"
    },
    "Children": [
      {
        "Id": "6d4a-7733-d725-a267"
      },
      {
        "Id": "dbb2-4d85-84c2-528c"
      }
    ]
  },
  {
    "Id": "statline_579",
    "Name": "Officer",
    "Type": "Statline",
    "Attributes": {
      "M": "4",
      "WS": "3",
      "BS": "3",
      "S": "3",
      "T": "3",
      "W": "1",
      "I": "3",
      "A": "2",
      "Ld": "6"
    },
    "Children": [
      {
        "Id": "6d4a-7733-d725-a267"
      },
      {
        "Id": "dbb2-4d85-84c2-528c"
      }
    ]
  },
  {
    "Id": "statline_580",
    "Name": "Veteran Sellswords",
    "Type": "Statline",
    "Attributes": {
      "M": "4",
      "WS": "4",
      "BS": "3",
      "S": "3",
      "T": "3",
      "W": "1",
      "I": "3",
      "A": "1",
      "Ld": "5"
    },
    "Children": [
      {
        "Id": "6d4a-7733-d725-a267"
      },
      {
        "Id": "dbb2-4d85-84c2-528c"
      }
    ]
  },
  {
    "Id": "statline_581",
    "Name": "Veteran Officer",
    "Type": "Statline",
    "Attributes": {
      "M": "4",
      "WS": "4",
      "BS": "3",
      "S": "3",
      "T": "3",
      "W": "1",
      "I": "3",
      "A": "2",
      "Ld": "6"
    },
    "Children": [
      {
        "Id": "6d4a-7733-d725-a267"
      },
      {
        "Id": "dbb2-4d85-84c2-528c"
      }
    ]
  },
  {
    "Id": "statline_582",
    "Name": "Renegade Captain",
    "Type": "Statline",
    "Attributes": {
      "M": "4",
      "WS": "5",
      "BS": "4",
      "S": "4",
      "T": "4",
      "W": "2",
      "I": "4",
      "A": "2",
      "Ld": "7"
    },
    "Children": [
      {
        "Id": "6d4a-7733-d725-a267"
      },
      {
        "Id": "dbb2-4d85-84c2-528c"
      }
    ]
  },
  {
    "Id": "statline_584",
    "Name": "Renegade Prince",
    "Type": "Statline",
    "Attributes": {
      "M": "4",
      "WS": "6",
      "BS": "4",
      "S": "4",
      "T": "4",
      "W": "3",
      "I": "5",
      "A": "3",
      "Ld": "8"
    },
    "Children": [
      {
        "Id": "6d4a-7733-d725-a267"
      },
      {
        "Id": "dbb2-4d85-84c2-528c"
      }
    ]
  }
]