[
  {
    "Id": "statline_716",
    "Name": "Arch Necrotect",
    "Type": "Statline",
    "Attributes": {
      "M": "4",
      "WS": "4",
      "BS": "3",
      "S": "4",
      "T": "4",
      "W": "3",
      "I": "3",
      "A": "3",
      "Ld": "8"
    },
    "Children": [
      {
        "Id": "6d4a-7733-d725-a267"
      },
      {
        "Id": "dbb2-4d85-84c2-528c"
      },
      {
        "Id": "7505-7edf-c3de-57a6"
      }
    ]
  },
  {
    "Id": "statline_717",
    "Name": "Necroserpent",
    "Type": "Statline",
    "Attributes": {
      "M": "7",
      "WS": "3",
      "BS": "0",
      "S": "5",
      "T": "4",
      "W": "3",
      "I": "3",
      "A": "3",
      "Ld": "7"
    },
    "Children": [
      {
        "Id": "6d4a-7733-d725-a267"
      }
    ]
  },
  {
    "Id": "statline_718",
    "Name": "Venerable Ushabti",
    "Type": "Statline",
    "Attributes": {
      "M": "4",
      "WS": "5",
      "BS": "3",
      "S": "5",
      "T": "4",
      "W": "3",
      "I": "2",
      "A": "3",
      "Ld": "8"
    },
    "Children": [
      {
        "Id": "6d4a-7733-d725-a267"
      },
      {
        "Id": "c56e-8d1b-bb4-de99"
      },
      {
        "Id": "2c5f-ac49-f54a-1329"
      }
    ]
  },
  {
    "Id": "statline_719",
    "Name": "Venerable Ancient",
    "Type": "Statline",
    "Attributes": {
      "M": "4",
      "WS": "5",
      "BS": "3",
      "S": "5",
      "T": "4",
      "W": "3",
      "I": "2",
      "A": "4",
      "Ld": "8"
    },
    "Children": [
      {
        "Id": "5f1c-fd04-b0d5-d5e"
      },
      {
        "Id": "6d4a-7733-d725-a267"
      },
      {
        "Id": "c56e-8d1b-bb4-de99"
      },
      {
        "Id": "2c5f-ac49-f54a-1329"
      }
    ]
  }
]