[
  {
    "Id": "statline_49",
    "Name": "Gor",
    "Type": "Statline",
    "Attributes": {
      "M": "5",
      "WS": "4",
      "BS": "2",
      "S": "3",
      "T": "4",
      "W": "1",
      "I": "3",
      "A": "1",
      "Ld": "6"
    },
    "Children": [
      {
        "Id": "44c2-f355-d5ed-24d7"
      },
      {
        "Id": "6d4a-7733-d725-a267"
      }
    ]
  },
  {
    "Id": "statline_50",
    "Name": "True-horn",
    "Type": "Statline",
    "Attributes": {
      "M": "5",
      "WS": "4",
      "BS": "2",
      "S": "3",
      "T": "4",
      "W": "1",
      "I": "3",
      "A": "2",
      "Ld": "7"
    },
    "Children": [
      {
        "Id": "44c2-f355-d5ed-24d7"
      },
      {
        "Id": "5f1c-fd04-b0d5-d5e"
      },
      {
        "Id": "6d4a-7733-d725-a267"
      }
    ]
  }
]