[
  {
    "Id": "statline_505",
    "Name": "Giant",
    "Type": "Statline",
    "Attributes": {
      "M": "6",
      "WS": "3",
      "BS": "1",
      "S": "6",
      "T": "6",
      "W": "6",
      "I": "2",
      "A": "*",
      "Ld": "10"
    },
    "Children": [
      {
        "Id": "742-e3dd-26f9-778f"
      },
      {
        "Id": "dbb2-4d85-84c2-528c"
      }
    ]
  },
  {
    "Id": "statline_559",
    "Name": "Snotling Crew",
    "Type": "Statline",
    "Attributes": {
      "M": "-",
      "WS": "2",
      "BS": "2",
      "S": "2",
      "T": "-",
      "W": "-",
      "I": "3",
      "A": "1",
      "Ld": "4"
    },
    "Children": [
      {
        "Id": "6d4a-7733-d725-a267"
      },
      {
        "Id": "eee5-db12-1271-f2c5"
      }
    ]
  }
]