[
  {
    "Id": "statline_3101",
    "Name": "Kayvaan Shrike",
    "Type": "Statline",
    "Attributes": {
      "M": "12\"",
      "T": "4",
      "SV": "3+",
      "W": "5",
      "LD": "6+",
      "OC": "1",
      "InSv": "4+"
    }
  },
  {
    "Id": "statline_3103",
    "Name": "Blackout",
    "Type": "Statline",
    "Attributes": {
      "Range": "18\"",
      "A": "2",
      "BS": "2+",
      "S": "5",
      "AP": "-1",
      "D": "2"
    }
  },
  {
    "Id": "statline_3104",
    "Name": "The Raven's Talons",
    "Type": "Statline",
    "Attributes": {
      "Range": "Melee",
      "A": "7",
      "WS": "2+",
      "S": "5",
      "AP": "-2",
      "D": "2"
    }
  },
  {
    "Id": "statline_3102",
    "Name": "Aethon Shaan",
    "Type": "Statline",
    "Attributes": {
      "M": "14\"",
      "T": "5",
      "SV": "3+",
      "W": "5",
      "LD": "6+",
      "OC": "1",
      "InSv": "4+"
    }
  },
  {
    "Id": "statline_2cbe-10b2-3653-4b55",
    "Name": "Heavy Bolt Pistol",
    "Type": "Statline",
    "Attributes": {
      "Range": "18\"",
      "A": "1",
      "BS": "2+",
      "S": "5",
      "AP": "-1",
      "D": "1"
    }
  },
  {
    "Id": "statline_3105",
    "Name": "Claws of Severax",
    "Type": "Statline",
    "Attributes": {
      "Range": "Melee",
      "A": "7",
      "WS": "2+",
      "S": "5",
      "AP": "-2",
      "D": "2"
    }
  }
]
