[
  {
    "Id": "statline_403",
    "Name": "Grail Monk",
    "Type": "Statline",
    "Attributes": {
      "M": "4",
      "WS": "2",
      "BS": "2",
      "S": "3",
      "T": "3",
      "W": "1",
      "I": "2",
      "A": "2",
      "Ld": "6"
    },
    "Children": [
      {
        "Id": "6d4a-7733-d725-a267"
      },
      {
        "Id": "dbb2-4d85-84c2-528c"
      },
      {
        "Id": "e7c7-b48f-7d2c-b337",
        "Info": "(Double-handed)"
      },
      {
        "Id": "985a-110b-3393-79b7",
        "Info": "(Single handed)"
      },
      {
        "Id": "8997-c74d-3a8d-ecf9"
      }
    ]
  },
  {
    "Id": "statline_406",
    "Name": "First Knight",
    "Type": "Statline",
    "Attributes": {
      "M": "-",
      "WS": "4",
      "BS": "2",
      "S": "3",
      "T": "3",
      "W": "1",
      "I": "3",
      "A": "2",
      "Ld": "8"
    },
    "Children": [
      {
        "Id": "6d4a-7733-d725-a267"
      },
      {
        "Id": "c56e-8d1b-bb4-de99"
      },
      {
        "Id": "3520-64c9-a855-ce9e"
      },
      {
        "Id": "8997-c74d-3a8d-ecf9"
      }
    ]
  }
]