[
  {
    "Id": "statline_267",
    "Name": "Shrine Guards",
    "Type": "Statline",
    "Attributes": {
      "M": "3",
      "WS": "5",
      "BS": "3",
      "S": "4",
      "T": "4",
      "W": "1",
      "I": "3",
      "A": "2",
      "Ld": "10"
    },
    "Children": [
      {
        "Id": "6d4a-7733-d725-a267"
      }
    ]
  },
  {
    "Id": "statline_268",
    "Name": "Shrine Keeper (Shrine Guard)",
    "Type": "Statline",
    "Attributes": {
      "M": "3",
      "WS": "6",
      "BS": "3",
      "S": "4",
      "T": "4",
      "W": "2",
      "I": "3",
      "A": "2",
      "Ld": "10"
    }
  },
  {
    "Id": "statline_269",
    "Name": "Imperial Dwarf Warrior",
    "Type": "Statline",
    "Attributes": {
      "M": "3",
      "WS": "4",
      "BS": "3",
      "S": "3",
      "T": "4",
      "W": "1",
      "I": "2",
      "A": "2",
      "Ld": "9"
    },
    "Children": [
      {
        "Id": "6d4a-7733-d725-a267"
      },
      {
        "Id": "dbb2-4d85-84c2-528c"
      }
    ]
  }
]