[
  {
    "Id": "statline_293",
    "Name": "Dragon Company trooper",
    "Type": "Statline",
    "Attributes": {
      "M": "3",
      "WS": "4",
      "BS": "3",
      "S": "3",
      "T": "4",
      "W": "1",
      "I": "2",
      "A": "1",
      "Ld": "9"
    },
    "Children": [
      {
        "Id": "3f0e-1dc6-b425-bf59"
      },
      {
        "Id": "6d4a-7733-d725-a267"
      },
      {
        "Id": "dbb2-4d85-84c2-528c"
      },
      {
        "Id": "8997-c74d-3a8d-ecf9"
      },
      {
        "Id": "bcf8-d942-102e-b155"
      }
    ]
  },
  {
    "Id": "statline_294",
    "Name": "Captain of the Empire",
    "Type": "Statline",
    "Attributes": {
      "M": "4",
      "WS": "5",
      "BS": "5",
      "S": "4",
      "T": "4",
      "W": "2",
      "I": "4",
      "A": "2",
      "Ld": "9"
    },
    "Children": [
      {
        "Id": "6d4a-7733-d725-a267"
      },
      {
        "Id": "dbb2-4d85-84c2-528c"
      }
    ]
  },
  {
    "Id": "statline_295",
    "Name": "Master Mage",
    "Type": "Statline",
    "Attributes": {
      "M": "4",
      "WS": "3",
      "BS": "3",
      "S": "3",
      "T": "3",
      "W": "2",
      "I": "3",
      "A": "1",
      "Ld": "7"
    },
    "Children": [
      {
        "Id": "3c27-d55d-e778-cb89"
      },
      {
        "Id": "6d4a-7733-d725-a267"
      }
    ]
  },
  {
    "Id": "statline_296",
    "Name": "Priest of Sigmar",
    "Type": "Statline",
    "Attributes": {
      "M": "4",
      "WS": "4",
      "BS": "3",
      "S": "4",
      "T": "4",
      "W": "2",
      "I": "4",
      "A": "2",
      "Ld": "7"
    },
    "Children": [
      {
        "Id": "6d4a-7733-d725-a267"
      },
      {
        "Id": "dbb2-4d85-84c2-528c"
      }
    ]
  },
  {
    "Id": "statline_297",
    "Name": "Priest of Ulric",
    "Type": "Statline",
    "Attributes": {
      "M": "4",
      "WS": "4",
      "BS": "3",
      "S": "4",
      "T": "4",
      "W": "2",
      "I": "4",
      "A": "2",
      "Ld": "7"
    },
    "Children": [
      {
        "Id": "6d4a-7733-d725-a267"
      },
      {
        "Id": "c56e-8d1b-bb4-de99"
      }
    ]
  },
  {
    "Id": "statline_298",
    "Name": "State Trooper",
    "Type": "Statline",
    "Attributes": {
      "M": "4",
      "WS": "3",
      "BS": "3",
      "S": "3",
      "T": "3",
      "W": "1",
      "I": "3",
      "A": "1",
      "Ld": "7"
    },
    "Children": [
      {
        "Id": "6d4a-7733-d725-a267"
      },
      {
        "Id": "dbb2-4d85-84c2-528c"
      },
      {
        "Id": "85-9154-7dc1-ddc6"
      }
    ]
  },
  {
    "Id": "statline_299",
    "Name": "Sargeant",
    "Type": "Statline",
    "Attributes": {
      "M": "4",
      "WS": "3",
      "BS": "3",
      "S": "3",
      "T": "3",
      "W": "1",
      "I": "3",
      "A": "2",
      "Ld": "7"
    },
    "Children": [
      {
        "Id": "5f1c-fd04-b0d5-d5e"
      },
      {
        "Id": "6d4a-7733-d725-a267"
      },
      {
        "Id": "dbb2-4d85-84c2-528c"
      },
      {
        "Id": "85-9154-7dc1-ddc6"
      }
    ]
  },
  {
    "Id": "statline_300",
    "Name": "State Missile Trooper",
    "Type": "Statline",
    "Attributes": {
      "M": "4",
      "WS": "3",
      "BS": "3",
      "S": "3",
      "T": "3",
      "W": "1",
      "I": "3",
      "A": "1",
      "Ld": "7"
    },
    "Children": [
      {
        "Id": "1ef1-8579-c310-4fb5"
      },
      {
        "Id": "6d4a-7733-d725-a267"
      }
    ]
  },
  {
    "Id": "statline_301",
    "Name": "Sergeant",
    "Type": "Statline",
    "Attributes": {
      "M": "4",
      "WS": "3",
      "BS": "4",
      "S": "3",
      "T": "3",
      "W": "1",
      "I": "3",
      "A": "1",
      "Ld": "7"
    },
    "Children": [
      {
        "Id": "5f1c-fd04-b0d5-d5e"
      },
      {
        "Id": "1ef1-8579-c310-4fb5"
      },
      {
        "Id": "6d4a-7733-d725-a267"
      }
    ]
  },
  {
    "Id": "statline_302",
    "Name": "Militia Fighter",
    "Type": "Statline",
    "Attributes": {
      "M": "4",
      "WS": "3",
      "BS": "3",
      "S": "3",
      "T": "3",
      "W": "1",
      "I": "3",
      "A": "1",
      "Ld": "6"
    },
    "Children": [
      {
        "Id": "eee5-db12-1271-f2c5"
      },
      {
        "Id": "9bc5-ae1d-c50c-3442"
      }
    ]
  },
  {
    "Id": "statline_303",
    "Name": "Militia Leader",
    "Type": "Statline",
    "Attributes": {
      "M": "4",
      "WS": "3",
      "BS": "3",
      "S": "3",
      "T": "3",
      "W": "1",
      "I": "3",
      "A": "2",
      "Ld": "7"
    },
    "Children": [
      {
        "Id": "5f1c-fd04-b0d5-d5e"
      },
      {
        "Id": "eee5-db12-1271-f2c5"
      },
      {
        "Id": "9bc5-ae1d-c50c-3442"
      }
    ]
  },
  {
    "Id": "statline_304",
    "Name": "Archer",
    "Type": "Statline",
    "Attributes": {
      "M": "4",
      "WS": "3",
      "BS": "3",
      "S": "3",
      "T": "3",
      "W": "1",
      "I": "3",
      "A": "1",
      "Ld": "7"
    },
    "Children": [
      {
        "Id": "6d4a-7733-d725-a267"
      },
      {
        "Id": "d6b8-1ad9-d024-1d72"
      }
    ]
  },
  {
    "Id": "statline_305",
    "Name": "Marksman",
    "Type": "Statline",
    "Attributes": {
      "M": "4",
      "WS": "3",
      "BS": "4",
      "S": "3",
      "T": "3",
      "W": "1",
      "I": "3",
      "A": "1",
      "Ld": "7"
    },
    "Children": [
      {
        "Id": "5f1c-fd04-b0d5-d5e"
      },
      {
        "Id": "6d4a-7733-d725-a267"
      },
      {
        "Id": "d6b8-1ad9-d024-1d72"
      }
    ]
  },
  {
    "Id": "statline_306",
    "Name": "Pistolier",
    "Type": "Statline",
    "Attributes": {
      "M": "-",
      "WS": "3",
      "BS": "3",
      "S": "3",
      "T": "3",
      "W": "1",
      "I": "3",
      "A": "1",
      "Ld": "6"
    },
    "Children": [
      {
        "Id": "3f0e-1dc6-b425-bf59"
      },
      {
        "Id": "6d4a-7733-d725-a267"
      },
      {
        "Id": "c56e-8d1b-bb4-de99"
      }
    ]
  },
  {
    "Id": "statline_307",
    "Name": "Empire Warhorse",
    "Type": "Statline",
    "Attributes": {
      "M": "8",
      "WS": "3",
      "BS": "-",
      "S": "3",
      "T": "-",
      "W": "-",
      "I": "3",
      "A": "1",
      "Ld": "-"
    },
    "Children": [
      {
        "Id": "6d4a-7733-d725-a267"
      }
    ]
  },
  {
    "Id": "statline_308",
    "Name": "Veteran",
    "Type": "Statline",
    "Attributes": {
      "M": "-",
      "WS": "3",
      "BS": "4",
      "S": "3",
      "T": "3",
      "W": "1",
      "I": "3",
      "A": "1",
      "Ld": "7"
    },
    "Children": [
      {
        "Id": "3f0e-1dc6-b425-bf59"
      },
      {
        "Id": "5f1c-fd04-b0d5-d5e"
      },
      {
        "Id": "b8f7-c4e5-2793-bc18"
      },
      {
        "Id": "6d4a-7733-d725-a267"
      },
      {
        "Id": "c56e-8d1b-bb4-de99"
      }
    ]
  },
  {
    "Id": "statline_309",
    "Name": "Outriders",
    "Type": "Statline",
    "Attributes": {
      "M": "-",
      "WS": "3",
      "BS": "4",
      "S": "3",
      "T": "3",
      "W": "1",
      "I": "3",
      "A": "1",
      "Ld": "7"
    },
    "Children": [
      {
        "Id": "6d4a-7733-d725-a267"
      },
      {
        "Id": "c56e-8d1b-bb4-de99"
      },
      {
        "Id": "4c62-cdd4-4e0c-4265"
      },
      {
        "Id": "7f58-91d4-ee6c-3cb7"
      }
    ]
  },
  {
    "Id": "statline_310",
    "Name": "Sharpshooter",
    "Type": "Statline",
    "Attributes": {
      "M": "-",
      "WS": "3",
      "BS": "5",
      "S": "3",
      "T": "3",
      "W": "1",
      "I": "3",
      "A": "1",
      "Ld": "7"
    },
    "Children": [
      {
        "Id": "3f0e-1dc6-b425-bf59"
      },
      {
        "Id": "5f1c-fd04-b0d5-d5e"
      },
      {
        "Id": "6d4a-7733-d725-a267"
      },
      {
        "Id": "c56e-8d1b-bb4-de99"
      },
      {
        "Id": "4c62-cdd4-4e0c-4265"
      },
      {
        "Id": "7f58-91d4-ee6c-3cb7"
      }
    ]
  }
]