[
  {
    "Id": "statline_1",
    "Name": "Truthsayer",
    "Type": "Statline",
    "Attributes": {
      "M": "4",
      "WS": "4",
      "BS": "3",
      "S": "4",
      "T": "4",
      "W": "3",
      "I": "4",
      "A": "2",
      "LD": "9"
    },
    "Children": [
      {
        "Id": "rule_1751004873288"
      }
    ]
  },
  {
    "Id": "statline_2",
    "Name": "Warhorse",
    "Type": "Statline",
    "Attributes": {
      "M": "8",
      "WS": "3",
      "BS": null,
      "S": "3",
      "T": "3",
      "W": "1",
      "I": "3",
      "A": "1",
      "LD": "5"
    }
  },
  {
    "Id": "statline_3",
    "Name": "Chariot",
    "Type": "Statline",
    "Attributes": {
      "M": "7",
      "WS": null,
      "BS": null,
      "S": "4",
      "T": "4",
      "W": "3",
      "I": null,
      "A": null,
      "LD": null
    }
  },
  {
    "Id": "statline_4",
    "Name": "Charioteer",
    "Type": "Statline",
    "Attributes": {
      "M": null,
      "WS": "4",
      "BS": "3",
      "S": "3",
      "T": null,
      "W": null,
      "I": "3",
      "A": "1",
      "LD": "8"
    }
  },
  {
    "Id": "statline_5",
    "Name": "Elk",
    "Type": "Statline",
    "Attributes": {
      "M": "8",
      "WS": "3",
      "BS": "0",
      "S": "4",
      "T": "3",
      "W": "1",
      "I": "3",
      "A": "1",
      "LD": "5"
    }
  },
  {
    "Id": "statline_6",
    "Name": "Warleader",
    "Type": "Statline",
    "Attributes": {
      "M": "4",
      "WS": "6",
      "BS": "5",
      "S": "4",
      "T": "4",
      "W": "3",
      "I": "6",
      "A": "4",
      "LD": "9"
    },
    "Children": [
      {
        "Id": "rule_1751004873288"
      }
    ]
  },
  {
    "Id": "statline_7",
    "Name": "Mastodon",
    "Type": "Statline",
    "Attributes": {
      "M": "6",
      "WS": "3",
      "BS": null,
      "S": "5",
      "T": "6",
      "W": "6",
      "I": "1",
      "A": "4",
      "LD": "6"
    }
  },
  {
    "Id": "statline_8",
    "Name": "Crewman",
    "Type": "Statline",
    "Attributes": {
      "M": null,
      "WS": "3",
      "BS": "3",
      "S": "3",
      "T": null,
      "W": null,
      "I": "3",
      "A": "1",
      "LD": "7"
    }
  },
  {
    "Id": "statline_9",
    "Name": "Shieldbearers",
    "Type": "Statline",
    "Attributes": {
      "M": "4",
      "WS": "4",
      "BS": "3",
      "S": "4",
      "T": null,
      "W": null,
      "I": "4",
      "A": "2",
      "LD": null
    }
  },
  {
    "Id": "statline_10",
    "Name": "Chieftain",
    "Type": "Statline",
    "Attributes": {
      "M": "4",
      "WS": "5",
      "BS": "5",
      "S": "4",
      "T": "4",
      "W": "2",
      "I": "5",
      "A": "3",
      "LD": "8"
    }
  },
  {
    "Id": "statline_11",
    "Name": "Wyrd Druid",
    "Type": "Statline",
    "Attributes": {
      "M": "4",
      "WS": "4",
      "BS": "3",
      "S": "4",
      "T": "3",
      "W": "2",
      "I": "4",
      "A": "1",
      "LD": "8"
    }
  },
  {
    "Id": "statline_12",
    "Name": "Aonbarr",
    "Type": "Statline",
    "Attributes": {
      "M": "4",
      "WS": "4",
      "BS": "3",
      "S": "3",
      "T": "3",
      "W": "1",
      "I": "3",
      "A": "1",
      "LD": "8"
    }
  },
  {
    "Id": "statline_13",
    "Name": "Warhorse",
    "Type": "Statline",
    "Attributes": {
      "M": "8",
      "WS": "3",
      "BS": "",
      "S": "3",
      "T": "3",
      "W": "1",
      "I": "3",
      "A": "1",
      "LD": "5"
    }
  },
  {
    "Id": "statline_14",
    "Name": "Chariot",
    "Type": "Statline",
    "Attributes": {
      "M": "7",
      "WS": "",
      "BS": "",
      "S": "4",
      "T": "4",
      "W": "3",
      "I": "",
      "A": "",
      "LD": ""
    }
  },
  {
    "Id": "statline_15",
    "Name": "Charioteer",
    "Type": "Statline",
    "Attributes": {
      "M": "",
      "WS": "4",
      "BS": "3",
      "S": "3",
      "T": "",
      "W": "",
      "I": "3",
      "A": "1",
      "LD": "8"
    }
  },
  {
    "Id": "statline_16",
    "Name": "Chariot Master",
    "Type": "Statline",
    "Attributes": {
      "M": "",
      "WS": "4",
      "BS": "3",
      "S": "3",
      "T": "",
      "W": "",
      "I": "3",
      "A": "2",
      "LD": "8"
    }
  },
  {
    "Id": "statline_17",
    "Name": "Tribal Warrior",
    "Type": "Statline",
    "Attributes": {
      "M": "4",
      "WS": "3",
      "BS": "3",
      "S": "3",
      "T": "3",
      "W": "1",
      "I": "3",
      "A": "1",
      "LD": "7"
    }
  },
  {
    "Id": "statline_18",
    "Name": "Hunting Dog",
    "Type": "Statline",
    "Attributes": {
      "M": "7",
      "WS": "3",
      "BS": "",
      "S": "3",
      "T": "3",
      "W": "1",
      "I": "3",
      "A": "1",
      "LD": "5"
    }
  },
  {
    "Id": "statline_19",
    "Name": "Woad Raider",
    "Type": "Statline",
    "Attributes": {
      "M": "4",
      "WS": "4",
      "BS": "3",
      "S": "3",
      "T": "3",
      "W": "1",
      "I": "3",
      "A": "1",
      "LD": "7"
    }
  },
  {
    "Id": "statline_20",
    "Name": "Youngbloods",
    "Type": "Statline",
    "Attributes": {
      "M": "4",
      "WS": "3",
      "BS": "3",
      "S": "3",
      "T": "3",
      "W": "1",
      "I": "3",
      "A": "1",
      "LD": "6"
    }
  },
  {
    "Id": "statline_21",
    "Name": "Centaur",
    "Type": "Statline",
    "Attributes": {
      "M": "8",
      "WS": "4",
      "BS": "3",
      "S": "4",
      "T": "4",
      "W": "1",
      "I": "4",
      "A": "2",
      "LD": "8"
    }
  },
  {
    "Id": "statline_22",
    "Name": "Druid Neophyte",
    "Type": "Statline",
    "Attributes": {
      "M": "4",
      "WS": "3",
      "BS": "3",
      "S": "3",
      "T": "3",
      "W": "1",
      "I": "4",
      "A": "1",
      "LD": "8"
    }
  },
  {
    "Id": "statline_23",
    "Name": "Fenbeast",
    "Type": "Statline",
    "Attributes": {
      "M": "5",
      "WS": "3",
      "BS": "",
      "S": "5",
      "T": "5",
      "W": "4",
      "I": "1",
      "A": "3",
      "LD": "8"
    }
  },
  {
    "Id": "statline_24",
    "Name": "Half Giant",
    "Type": "Statline",
    "Attributes": {
      "M": "6",
      "WS": "3",
      "BS": "2",
      "S": "5",
      "T": "4",
      "W": "3",
      "I": "2",
      "A": "3",
      "LD": "7"
    }
  },
  {
    "Id": "statline_25",
    "Name": "Hearthguard",
    "Type": "Statline",
    "Attributes": {
      "M": "4",
      "WS": "4",
      "BS": "3",
      "S": "4",
      "T": "3",
      "W": "1",
      "I": "4",
      "A": "1",
      "LD": "8"
    }
  },
  {
    "Id": "statline_26",
    "Name": "Hunter",
    "Type": "Statline",
    "Attributes": {
      "M": "4",
      "WS": "3",
      "BS": "4",
      "S": "3",
      "T": "3",
      "W": "1",
      "I": "3",
      "A": "1",
      "LD": "7"
    }
  },
  {
    "Id": "statline_27",
    "Name": "Pixie Swarm",
    "Type": "Statline",
    "Attributes": {
      "M": "1",
      "WS": "3",
      "BS": "3",
      "S": "1",
      "T": "1",
      "W": "8",
      "I": "5",
      "A": "10",
      "LD": "8"
    }
  },
  {
    "Id": "statline_28",
    "Name": "Swordmaiden",
    "Type": "Statline",
    "Attributes": {
      "M": "4",
      "WS": "4",
      "BS": "3",
      "S": "3",
      "T": "3",
      "W": "1",
      "I": "4",
      "A": "1",
      "LD": "8"
    }
  },
  {
    "Id": "statline_29",
    "Name": "Viridian Lord",
    "Type": "Statline",
    "Attributes": {
      "M": "4",
      "WS": "5",
      "BS": "3",
      "S": "4",
      "T": "4",
      "W": "1",
      "I": "4",
      "A": "2",
      "LD": "9"
    }
  },
  {
    "Id": "statline_30",
    "Name": "Warrior of Danu",
    "Type": "Statline",
    "Attributes": {
      "M": "4",
      "WS": "4",
      "BS": "3",
      "S": "5",
      "T": "4",
      "W": "2",
      "I": "4",
      "A": "2",
      "LD": "8"
    }
  },
  {
    "Id": "statline_31",
    "Name": "Bonegrinder Giant",
    "Type": "Statline",
    "Attributes": {
      "M": "10",
      "WS": "3",
      "BS": "3",
      "S": "8",
      "T": "8",
      "W": "8",
      "I": "1",
      "A": "",
      "LD": "10"
    }
  },
  {
    "Id": "statline_32",
    "Name": "Fenhulk",
    "Type": "Statline",
    "Attributes": {
      "M": "5",
      "WS": "3",
      "BS": "",
      "S": "6",
      "T": "6",
      "W": "6",
      "I": "1",
      "A": "5",
      "LD": "8"
    }
  },
  {
    "Id": "statline_33",
    "Name": "Giant",
    "Type": "Statline",
    "Attributes": {
      "M": "6",
      "WS": "3",
      "BS": "3",
      "S": "6",
      "T": "6",
      "W": "6",
      "I": "3",
      "A": "",
      "LD": "10"
    }
  },
  {
    "Id": "statline_34",
    "Name": "Mastodon",
    "Type": "Statline",
    "Attributes": {
      "M": "6",
      "WS": "3",
      "BS": "",
      "S": "5",
      "T": "6",
      "W": "6",
      "I": "1",
      "A": "4",
      "LD": "6"
    }
  },
  {
    "Id": "statline_35",
    "Name": "Crewman",
    "Type": "Statline",
    "Attributes": {
      "M": "",
      "WS": "3",
      "BS": "3",
      "S": "3",
      "T": "",
      "W": "",
      "I": "3",
      "A": "1",
      "LD": "7"
    }
  },
  {
    "Id": "statline_36",
    "Name": "Stone Thrower",
    "Type": "Statline",
    "Attributes": {
      "M": "",
      "WS": "",
      "BS": "",
      "S": "",
      "T": "7",
      "W": "",
      "I": "",
      "A": "",
      "LD": ""
    }
  },
  {
    "Id": "statline_37",
    "Name": "Crewman",
    "Type": "Statline",
    "Attributes": {
      "M": "4",
      "WS": "3",
      "BS": "3",
      "S": "3",
      "T": "3",
      "W": "1",
      "I": "3",
      "A": "1",
      "LD": "7"
    }
  }
]