[
  {
    "Id": "statline_3107",
    "Name": "Adrax Agatone",
    "Type": "Statline",
    "Attributes": {
      "M": "6\"",
      "T": "5",
      "SV": "2+",
      "W": "5",
      "LD": "6+",
      "OC": "1",
      "InSv": "4+"
    }
  },
  {
    "Id": "statline_3109",
    "Name": "Drakkis",
    "Type": "Statline",
    "Attributes": {
      "Range": "12\"",
      "A": "D6+3",
      "BS": "-",
      "S": "5",
      "AP": "-1",
      "D": "1"
    }
  },
  {
    "Id": "statline_3110",
    "Name": "Malleus Noctum",
    "Type": "Statline",
    "Attributes": {
      "Range": "Melee",
      "A": "5",
      "WS": "2+",
      "S": "10",
      "AP": "-2",
      "D": "3"
    }
  },
  {
    "Id": "statline_3108",
    "Name": "Vulkan He'stan",
    "Type": "Statline",
    "Attributes": {
      "M": "6\"",
      "T": "5",
      "SV": "2+",
      "W": "5",
      "LD": "6+",
      "OC": "1",
      "InSv": "4+"
    }
  },
  {
    "Id": "statlines_1777534675734",
    "Name": "Bolt pistol",
    "Type": "Statline",
    "Attributes": {
      "Range": "12\"",
      "A": "1",
      "BS": "2+",
      "S": "5",
      "AP": "-1",
      "D": "1"
    }
  },
  {
    "Id": "statline_3111",
    "Name": "Gauntlet of the Forge",
    "Type": "Statline",
    "Attributes": {
      "Range": "12\"",
      "A": "D6+3",
      "BS": "-",
      "S": "6",
      "AP": "-1",
      "D": "1"
    }
  },
  {
    "Id": "statline_3112",
    "Name": "Spear of Vulkan",
    "Type": "Statline",
    "Attributes": {
      "Range": "Melee",
      "A": "6",
      "WS": "2+",
      "S": "7",
      "AP": "-2",
      "D": "2"
    }
  }
]
