[
  {
    "Id": "statline_816",
    "Name": "Marauder Tribe Chieftain",
    "Type": "Statline",
    "Attributes": {
      "M": "4",
      "WS": "5",
      "BS": "3",
      "S": "4",
      "T": "4",
      "W": "2",
      "I": "4",
      "A": "3",
      "Ld": "8"
    },
    "Children": [
      {
        "Id": "6d4a-7733-d725-a267"
      },
      {
        "Id": "dbb2-4d85-84c2-528c"
      }
    ]
  },
  {
    "Id": "statline_817",
    "Name": "Marauder Tribe Berserker",
    "Type": "Statline",
    "Attributes": {
      "M": "5",
      "WS": "4",
      "BS": "3",
      "S": "3",
      "T": "4",
      "W": "1",
      "I": "3",
      "A": "1",
      "Ld": "7"
    },
    "Children": [
      {
        "Id": "6d4a-7733-d725-a267"
      },
      {
        "Id": "dbb2-4d85-84c2-528c"
      }
    ]
  },
  {
    "Id": "statline_818",
    "Name": "Headtaker",
    "Type": "Statline",
    "Attributes": {
      "M": "5",
      "WS": "4",
      "BS": "3",
      "S": "3",
      "T": "4",
      "W": "1",
      "I": "3",
      "A": "2",
      "Ld": ""
    },
    "Children": [
      {
        "Id": "6d4a-7733-d725-a267"
      },
      {
        "Id": "dbb2-4d85-84c2-528c"
      },
      {
        "Id": "5f1c-fd04-b0d5-d5e"
      }
    ]
  },
  {
    "Id": "statline_819",
    "Name": "Marauder Tribe Huscarl",
    "Type": "Statline",
    "Attributes": {
      "M": "4",
      "WS": "4",
      "BS": "3",
      "S": "3",
      "T": "4",
      "W": "1",
      "I": "3",
      "A": "1",
      "Ld": "7"
    },
    "Children": [
      {
        "Id": "ee75-c1a8-2f0c-c264"
      },
      {
        "Id": "6d4a-7733-d725-a267"
      },
      {
        "Id": "dbb2-4d85-84c2-528c"
      }
    ]
  },
  {
    "Id": "statline_820",
    "Name": "First Sword",
    "Type": "Statline",
    "Attributes": {
      "M": "4",
      "WS": "4",
      "BS": "3",
      "S": "3",
      "T": "4",
      "W": "1",
      "I": "3",
      "A": "2",
      "Ld": "8"
    },
    "Children": [
      {
        "Id": "ee75-c1a8-2f0c-c264"
      },
      {
        "Id": "6d4a-7733-d725-a267"
      },
      {
        "Id": "dbb2-4d85-84c2-528c"
      },
      {
        "Id": "5f1c-fd04-b0d5-d5e"
      }
    ]
  },
  {
    "Id": "statline_821",
    "Name": "Skin Wolf",
    "Type": "Statline",
    "Attributes": {
      "M": "7",
      "WS": "5",
      "BS": "-",
      "S": "4",
      "T": "4",
      "W": "3",
      "I": "4",
      "A": "3",
      "Ld": "7"
    },
    "Children": [
      {
        "Id": "6d4a-7733-d725-a267"
      }
    ]
  },
  {
    "Id": "statline_822",
    "Name": "Skin Wolf Jarl",
    "Type": "Statline",
    "Attributes": {
      "M": "7",
      "WS": "5",
      "BS": "-",
      "S": "4",
      "T": "4",
      "W": "3",
      "I": "4",
      "A": "4",
      "Ld": "7"
    },
    "Children": [
      {
        "Id": "6d4a-7733-d725-a267"
      },
      {
        "Id": "5f1c-fd04-b0d5-d5e"
      }
    ]
  }
]