[
  {
    "Id": "statline_260",
    "Name": "Dragon Company trooper",
    "Type": "Statline",
    "Attributes": {
      "M": "3",
      "WS": "4",
      "BS": "3",
      "S": "3",
      "T": "4",
      "W": "1",
      "I": "2",
      "A": "1",
      "Ld": "9"
    },
    "Children": [
      {
        "Id": "3f0e-1dc6-b425-bf59"
      },
      {
        "Id": "6d4a-7733-d725-a267"
      },
      {
        "Id": "dbb2-4d85-84c2-528c"
      },
      {
        "Id": "8997-c74d-3a8d-ecf9"
      }
    ]
  }
]