[
  {
    "Id": "statline_265",
    "Name": "Royal Clan Warrior",
    "Type": "Statline",
    "Attributes": {
      "M": "3",
      "WS": "4",
      "BS": "3",
      "S": "3",
      "T": "4",
      "W": "1",
      "I": "2",
      "A": "1",
      "Ld": "9"
    },
    "Children": [
      {
        "Id": "6d4a-7733-d725-a267"
      },
      {
        "Id": "c56e-8d1b-bb4-de99"
      }
    ]
  },
  {
    "Id": "statline_266",
    "Name": "Royal Clan Veteran",
    "Type": "Statline",
    "Attributes": {
      "M": "3",
      "WS": "4",
      "BS": "3",
      "S": "3",
      "T": "4",
      "W": "1",
      "I": "2",
      "A": "2",
      "Ld": "9"
    },
    "Children": [
      {
        "Id": "5f1c-fd04-b0d5-d5e"
      },
      {
        "Id": "6d4a-7733-d725-a267"
      },
      {
        "Id": "c56e-8d1b-bb4-de99"
      }
    ]
  }
]