[
  {
    "Id": "statline_774",
    "Name": "Saurus Oldblood",
    "Type": "Statline",
    "Attributes": {
      "M": "4",
      "WS": "6",
      "BS": "",
      "S": "5",
      "T": "5",
      "W": "3",
      "I": "3",
      "A": "5",
      "LD": "8"
    }
  },
  {
    "Id": "statline_775",
    "Name": "Horned One",
    "Type": "Statline",
    "Attributes": {
      "M": "8",
      "WS": "3",
      "BS": null,
      "S": "4",
      "T": "4",
      "W": "1",
      "I": "3",
      "A": "2",
      "LD": "3"
    }
  },
  {
    "Id": "statline_776",
    "Name": "Carnosaur",
    "Type": "Statline",
    "Attributes": {
      "M": "7",
      "WS": "4",
      "BS": null,
      "S": "6",
      "T": "5",
      "W": "5",
      "I": "2",
      "A": "4",
      "LD": "5"
    }
  },
  {
    "Id": "statline_777",
    "Name": "Slann Mage-Priest",
    "Type": "Statline",
    "Attributes": {
      "M": "4",
      "WS": "1",
      "BS": "3",
      "S": "3",
      "T": "4",
      "W": "5",
      "I": "1",
      "A": "",
      "LD": "9"
    }
  },
  {
    "Id": "statline_778",
    "Name": "Skink Attendant",
    "Type": "Statline",
    "Attributes": {
      "M": "",
      "WS": "2",
      "BS": "3",
      "S": "3",
      "T": "",
      "W": "",
      "I": "4",
      "A": "1",
      "LD": ""
    }
  },
  {
    "Id": "statline_779",
    "Name": "Saurus Scar-Veteran",
    "Type": "Statline",
    "Attributes": {
      "M": "4",
      "WS": "5",
      "BS": "",
      "S": "5",
      "T": "5",
      "W": "2",
      "I": "3",
      "A": "4",
      "LD": "8"
    }
  },
  {
    "Id": "statline_780",
    "Name": "Skink Chief",
    "Type": "Statline",
    "Attributes": {
      "M": "6",
      "WS": "4",
      "BS": "5",
      "S": "4",
      "T": "3",
      "W": "2",
      "I": "6",
      "A": "3",
      "LD": "6"
    }
  },
  {
    "Id": "statline_781",
    "Name": "Troglodon",
    "Type": "Statline",
    "Attributes": {
      "M": "7",
      "WS": "3",
      "BS": "4",
      "S": "5",
      "T": "5",
      "W": "5",
      "I": "2",
      "A": "3",
      "LD": "5"
    }
  },
  {
    "Id": "statline_782",
    "Name": "Ripperdactyl",
    "Type": "Statline",
    "Attributes": {
      "M": "2",
      "WS": "3",
      "BS": null,
      "S": "4",
      "T": "3",
      "W": "2",
      "I": "3",
      "A": "2",
      "LD": "3"
    }
  },
  {
    "Id": "statline_783",
    "Name": "Stegadon",
    "Type": "Statline",
    "Attributes": {
      "M": "6",
      "WS": "3",
      "BS": null,
      "S": "5",
      "T": "6",
      "W": "5",
      "I": "2",
      "A": "4",
      "LD": "6"
    }
  },
  {
    "Id": "statline_784",
    "Name": "Skink Crew",
    "Type": "Statline",
    "Attributes": {
      "M": null,
      "WS": "2",
      "BS": "3",
      "S": "3",
      "T": null,
      "W": null,
      "I": "4",
      "A": "1",
      "LD": "5"
    }
  },
  {
    "Id": "statline_785",
    "Name": "Skink Priest",
    "Type": "Statline",
    "Attributes": {
      "M": "6",
      "WS": "2",
      "BS": "3",
      "S": "3",
      "T": "2",
      "W": "2",
      "I": "4",
      "A": "1",
      "LD": "5"
    }
  },
  {
    "Id": "statline_786",
    "Name": "Ancient Stegadon",
    "Type": "Statline",
    "Attributes": {
      "M": "6",
      "WS": "3",
      "BS": null,
      "S": "6",
      "T": "6",
      "W": "5",
      "I": "1",
      "A": "3",
      "LD": "6"
    }
  },
  {
    "Id": "statline_787",
    "Name": "Coatl",
    "Type": "Statline",
    "Attributes": {
      "M": "5",
      "WS": "4",
      "BS": null,
      "S": "5",
      "T": "5",
      "W": "5",
      "I": "2",
      "A": "4",
      "LD": "8"
    }
  },
  {
    "Id": "statline_788",
    "Name": "Tiktaq'to",
    "Type": "Statline",
    "Attributes": {
      "M": "6",
      "WS": "4",
      "BS": "5",
      "S": "4",
      "T": "3",
      "W": "2",
      "I": "6",
      "A": "3",
      "LD": "7"
    }
  },
  {
    "Id": "statline_789",
    "Name": "Zwup",
    "Type": "Statline",
    "Attributes": {
      "M": "6",
      "WS": "3",
      "BS": "",
      "S": "4",
      "T": "3",
      "W": "2",
      "I": "2",
      "A": "1",
      "LD": "3"
    }
  },
  {
    "Id": "statline_790",
    "Name": "Cold One Rider",
    "Type": "Statline",
    "Attributes": {
      "M": "4",
      "WS": "4",
      "BS": "",
      "S": "4",
      "T": "4",
      "W": "1",
      "I": "2",
      "A": "2",
      "LD": "8"
    }
  },
  {
    "Id": "statline_791",
    "Name": "Jungle Swarm",
    "Type": "Statline",
    "Attributes": {
      "M": "5",
      "WS": "3",
      "BS": "",
      "S": "2",
      "T": "2",
      "W": "6",
      "I": "1",
      "A": "6",
      "LD": "3"
    }
  },
  {
    "Id": "statline_792",
    "Name": "Saurus Warrior",
    "Type": "Statline",
    "Attributes": {
      "M": "4",
      "WS": "3",
      "BS": "",
      "S": "4",
      "T": "4",
      "W": "1",
      "I": "1",
      "A": "2",
      "LD": "8"
    }
  },
  {
    "Id": "statline_793",
    "Name": "Skink",
    "Type": "Statline",
    "Attributes": {
      "M": "6",
      "WS": "2",
      "BS": "3",
      "S": "3",
      "T": "2",
      "W": "1",
      "I": "4",
      "A": "1",
      "LD": "5"
    }
  },
  {
    "Id": "statline_794",
    "Name": "Skink Skirmisher",
    "Type": "Statline",
    "Attributes": {
      "M": "6",
      "WS": "2",
      "BS": "3",
      "S": "3",
      "T": "2",
      "W": "1",
      "I": "4",
      "A": "1",
      "LD": "5"
    }
  },
  {
    "Id": "statline_795",
    "Name": "Chameleon Skink",
    "Type": "Statline",
    "Attributes": {
      "M": "6",
      "WS": "2",
      "BS": "4",
      "S": "3",
      "T": "2",
      "W": "1",
      "I": "4",
      "A": "1",
      "LD": "5"
    }
  },
  {
    "Id": "statline_796",
    "Name": "Great Crested Skink",
    "Type": "Statline",
    "Attributes": {
      "M": "6",
      "WS": "3",
      "BS": "3",
      "S": "3",
      "T": "2",
      "W": "1",
      "I": "4",
      "A": "1",
      "LD": "6"
    }
  },
  {
    "Id": "statline_797",
    "Name": "Horned One",
    "Type": "Statline",
    "Attributes": {
      "M": "8",
      "WS": "3",
      "BS": "",
      "S": "4",
      "T": "4",
      "W": "1",
      "I": "3",
      "A": "2",
      "LD": "3"
    }
  },
  {
    "Id": "statline_798",
    "Name": "Kroxigor",
    "Type": "Statline",
    "Attributes": {
      "M": "6",
      "WS": "3",
      "BS": "",
      "S": "5",
      "T": "4",
      "W": "3",
      "I": "1",
      "A": "3",
      "LD": "7"
    }
  },
  {
    "Id": "statline_799",
    "Name": "Razordon",
    "Type": "Statline",
    "Attributes": {
      "M": "6",
      "WS": "3",
      "BS": "3",
      "S": "5",
      "T": "4",
      "W": "3",
      "I": "4",
      "A": "2",
      "LD": "4"
    }
  },
  {
    "Id": "statline_800",
    "Name": "Ripperdactyl Rider",
    "Type": "Statline",
    "Attributes": {
      "M": "6",
      "WS": "3",
      "BS": "3",
      "S": "3",
      "T": "2",
      "W": "1",
      "I": "4",
      "A": "1",
      "LD": "6"
    }
  },
  {
    "Id": "statline_801",
    "Name": "Ripperdactyl",
    "Type": "Statline",
    "Attributes": {
      "M": "2",
      "WS": "3",
      "BS": "",
      "S": "4",
      "T": "3",
      "W": "2",
      "I": "3",
      "A": "2",
      "LD": "3"
    }
  },
  {
    "Id": "statline_802",
    "Name": "Salamander",
    "Type": "Statline",
    "Attributes": {
      "M": "6",
      "WS": "3",
      "BS": "3",
      "S": "5",
      "T": "4",
      "W": "3",
      "I": "4",
      "A": "2",
      "LD": "4"
    }
  },
  {
    "Id": "statline_803",
    "Name": "Temple Guard",
    "Type": "Statline",
    "Attributes": {
      "M": "4",
      "WS": "4",
      "BS": "",
      "S": "4",
      "T": "4",
      "W": "1",
      "I": "2",
      "A": "2",
      "LD": "8"
    }
  },
  {
    "Id": "statline_804",
    "Name": "Terradon Rider",
    "Type": "Statline",
    "Attributes": {
      "M": "6",
      "WS": "2",
      "BS": "3",
      "S": "3",
      "T": "2",
      "W": "1",
      "I": "4",
      "A": "1",
      "LD": "5"
    }
  },
  {
    "Id": "statline_805",
    "Name": "Bastiladon",
    "Type": "Statline",
    "Attributes": {
      "M": "4",
      "WS": "3",
      "BS": "",
      "S": "5",
      "T": "6",
      "W": "5",
      "I": "1",
      "A": "3",
      "LD": "6"
    }
  },
  {
    "Id": "statline_806",
    "Name": "Skink Crew",
    "Type": "Statline",
    "Attributes": {
      "M": "",
      "WS": "2",
      "BS": "3",
      "S": "3",
      "T": "",
      "W": "",
      "I": "4",
      "A": "1",
      "LD": "5"
    }
  },
  {
    "Id": "statline_807",
    "Name": "Coatl",
    "Type": "Statline",
    "Attributes": {
      "M": "5",
      "WS": "4",
      "BS": "",
      "S": "5",
      "T": "5",
      "W": "5",
      "I": "2",
      "A": "4",
      "LD": "8"
    }
  },
  {
    "Id": "statline_808",
    "Name": "Dread Saurian",
    "Type": "Statline",
    "Attributes": {
      "M": "7",
      "WS": "4",
      "BS": "",
      "S": "8",
      "T": "7",
      "W": "10",
      "I": "1",
      "A": "6",
      "LD": "6"
    }
  }
]