[
  {
    "Id": "statline_868",
    "Name": "Beast Keeper",
    "Type": "Statline",
    "Attributes": {
      "M": "5",
      "WS": "4",
      "BS": "4",
      "S": "3",
      "T": "3",
      "W": "1",
      "I": "4",
      "A": "1",
      "Ld": "8"
    },
    "Children": [
      {
        "Id": "6d4a-7733-d725-a267"
      },
      {
        "Id": "dbb2-4d85-84c2-528c"
      }
    ]
  }
]