[
  {
    "Id": "statline_373",
    "Name": "Chracian Chieftain",
    "Type": "Statline",
    "Attributes": {
      "M": "5",
      "WS": "6",
      "BS": "4",
      "S": "4",
      "T": "3",
      "W": "3",
      "I": "5",
      "A": "3",
      "Ld": "9"
    },
    "Children": [
      {
        "Id": "6d4a-7733-d725-a267"
      },
      {
        "Id": "c56e-8d1b-bb4-de99"
      }
    ]
  },
  {
    "Id": "statline_374",
    "Name": "Chracian Woodsman",
    "Type": "Statline",
    "Attributes": {
      "M": "5",
      "WS": "4",
      "BS": "4",
      "S": "4",
      "T": "3",
      "W": "1",
      "I": "4",
      "A": "1",
      "Ld": "8"
    },
    "Children": [
      {
        "Id": "66ca-f1a3-7cc3-723d"
      },
      {
        "Id": "6d4a-7733-d725-a267"
      },
      {
        "Id": "dbb2-4d85-84c2-528c"
      }
    ]
  },
  {
    "Id": "statline_375",
    "Name": "Chracian Captain",
    "Type": "Statline",
    "Attributes": {
      "M": "5",
      "WS": "4",
      "BS": "4",
      "S": "4",
      "T": "3",
      "W": "1",
      "I": "4",
      "A": "2",
      "Ld": "8"
    },
    "Children": [
      {
        "Id": "5f1c-fd04-b0d5-d5e"
      },
      {
        "Id": "66ca-f1a3-7cc3-723d"
      },
      {
        "Id": "6d4a-7733-d725-a267"
      },
      {
        "Id": "dbb2-4d85-84c2-528c"
      }
    ]
  },
  {
    "Id": "statline_376",
    "Name": "Lion Guard",
    "Type": "Statline",
    "Attributes": {
      "M": "5",
      "WS": "6",
      "BS": "4",
      "S": "4",
      "T": "3",
      "W": "1",
      "I": "5",
      "A": "1",
      "Ld": "9"
    },
    "Children": [
      {
        "Id": "66ca-f1a3-7cc3-723d"
      },
      {
        "Id": "6d4a-7733-d725-a267"
      },
      {
        "Id": "c56e-8d1b-bb4-de99"
      }
    ]
  },
  {
    "Id": "statline_377",
    "Name": "Lion Guard Captain",
    "Type": "Statline",
    "Attributes": {
      "M": "5",
      "WS": "6",
      "BS": "4",
      "S": "4",
      "T": "3",
      "W": "1",
      "I": "5",
      "A": "2",
      "Ld": "9"
    },
    "Children": [
      {
        "Id": "5f1c-fd04-b0d5-d5e"
      },
      {
        "Id": "66ca-f1a3-7cc3-723d"
      },
      {
        "Id": "6d4a-7733-d725-a267"
      },
      {
        "Id": "c56e-8d1b-bb4-de99"
      }
    ]
  }
]