[
  {
    "Id": "statline_378",
    "Name": "Sea Guard Garrison Commander",
    "Type": "Statline",
    "Attributes": {
      "M": "5",
      "WS": "6",
      "BS": "7",
      "S": "4",
      "T": "3",
      "W": "2",
      "I": "5",
      "A": "3",
      "Ld": "9"
    },
    "Children": [
      {
        "Id": "6d4a-7733-d725-a267"
      },
      {
        "Id": "dbb2-4d85-84c2-528c"
      },
      {
        "Id": "d6b8-1ad9-d024-1d72"
      }
    ]
  },
  {
    "Id": "statline_379",
    "Name": "Ship's Company",
    "Type": "Statline",
    "Attributes": {
      "M": "5",
      "WS": "4",
      "BS": "4",
      "S": "3",
      "T": "3",
      "W": "1",
      "I": "4",
      "A": "1",
      "Ld": "8"
    },
    "Children": [
      {
        "Id": "6d4a-7733-d725-a267"
      },
      {
        "Id": "d6b8-1ad9-d024-1d72"
      }
    ]
  },
  {
    "Id": "statline_380",
    "Name": "Midshipman",
    "Type": "Statline",
    "Attributes": {
      "M": "5",
      "WS": "4",
      "BS": "5",
      "S": "3",
      "T": "3",
      "W": "1",
      "I": "4",
      "A": "1",
      "Ld": "8"
    },
    "Children": [
      {
        "Id": "6d4a-7733-d725-a267"
      },
      {
        "Id": "d6b8-1ad9-d024-1d72"
      }
    ]
  },
  {
    "Id": "statline_381",
    "Name": "Bosun",
    "Type": "Statline",
    "Attributes": {
      "M": "5",
      "WS": "4",
      "BS": "4",
      "S": "3",
      "T": "3",
      "W": "1",
      "I": "4",
      "A": "2",
      "Ld": "8"
    },
    "Children": [
      {
        "Id": "6d4a-7733-d725-a267"
      },
      {
        "Id": "d6b8-1ad9-d024-1d72"
      }
    ]
  }
]