[
  {
    "Id": "statline_668",
    "Name": "Winged Warsphinx",
    "Type": "Statline",
    "Attributes": {
      "M": "6",
      "WS": "4",
      "BS": "0",
      "S": "5",
      "T": "6",
      "W": "5",
      "I": "1",
      "A": "4",
      "Ld": "8"
    },
    "Children": [
      {
        "Id": "8382-4e23-e72c-d90"
      },
      {
        "Id": "3845-49d0-ec6f-589"
      },
      {
        "Id": "2c1-76db-c762-d51e"
      },
      {
        "Id": "c56e-8d1b-bb4-de99"
      }
    ]
  }
]