[
  {
    "Id": "statline_2566",
    "Name": "Iron Father Feirros",
    "Type": "Statline",
    "Attributes": {
      "M": "5\"",
      "T": "6",
      "SV": "2+",
      "W": "6",
      "LD": "6+",
      "OC": "1"
    }
  },
  {
    "Id": "statlines_1777536527561",
    "Name": "Bolt pistol",
    "Type": "Statline",
    "Attributes": {
      "Range": "12\"",
      "A": "1",
      "BS": "2+",
      "S": "5",
      "AP": "-1",
      "D": "1"
    }
  },
  {
    "Id": "statline_2568",
    "Name": "Gorgon's Wrath",
    "Type": "Statline",
    "Attributes": {
      "Range": "36\"",
      "A": "3",
      "BS": "2+",
      "S": "6",
      "AP": "-1",
      "D": "2"
    }
  },
  {
    "Id": "statline_2569",
    "Name": "Harrowhand",
    "Type": "Statline",
    "Attributes": {
      "Range": "Melee",
      "A": "6",
      "WS": "3+",
      "S": "7",
      "AP": "-2",
      "D": "2"
    }
  },
  {
    "Id": "statline_2570",
    "Name": "Medusan Manipuli",
    "Type": "Statline",
    "Attributes": {
      "Range": "Melee",
      "A": "2",
      "WS": "3+",
      "S": "10",
      "AP": "-2",
      "D": "3"
    }
  },
  {
    "Id": "statline_2567",
    "Name": "Caanok Var",
    "Type": "Statline",
    "Attributes": {
      "M": "5\"",
      "T": "6",
      "SV": "2+",
      "W": "6",
      "LD": "6+",
      "OC": "1",
      "InSv": "4+"
    }
  },
  {
    "Id": "statlines_1777536414032",
    "Name": "Storm bolter",
    "Type": "Statline",
    "Attributes": {
      "Range": "24\"",
      "A": "2",
      "BS": "2+",
      "S": "5",
      "AP": "-1",
      "D": "1"
    }
  },
  {
    "Id": "statline_2571",
    "Name": "Axiom - Strike",
    "Type": "Statline",
    "Attributes": {
      "Range": "Melee",
      "A": "5",
      "WS": "2+",
      "S": "8",
      "AP": "-2",
      "D": "2"
    }
  },
  {
    "Id": "statline_2572",
    "Name": "Axiom - Sweep",
    "Type": "Statline",
    "Attributes": {
      "Range": "Melee",
      "A": "10",
      "WS": "2+",
      "S": "5",
      "AP": "-2",
      "D": "1"
    }
  }
]
