[
  {
    "Id": "statline_864",
    "Name": "Deepwood Hound",
    "Type": "Statline",
    "Attributes": {
      "M": "9",
      "WS": "4",
      "BS": "-",
      "S": "3",
      "T": "3",
      "W": "1",
      "I": "3",
      "A": "1",
      "Ld": "5"
    },
    "Children": [
      {
        "Id": "6d4a-7733-d725-a267"
      }
    ]
  }
]