[
  {
    "Id": "statline_515",
    "Name": "Eminent Magus",
    "Type": "Statline",
    "Attributes": {
      "M": "4",
      "WS": "3",
      "BS": "3",
      "S": "3",
      "T": "4",
      "W": "3",
      "I": "3",
      "A": "1",
      "LD": "8"
    }
  },
  {
    "Id": "statline_516",
    "Name": "Grand Commander",
    "Type": "Statline",
    "Attributes": {
      "M": "4",
      "WS": "6",
      "BS": "5",
      "S": "4",
      "T": "4",
      "W": "3",
      "I": "6",
      "A": "4",
      "LD": "9"
    }
  },
  {
    "Id": "statline_517",
    "Name": "Auroch",
    "Type": "Statline",
    "Attributes": {
      "M": "7",
      "WS": "3",
      "BS": null,
      "S": "5",
      "T": "4",
      "W": "3",
      "I": "3",
      "A": "3",
      "LD": "6"
    }
  },
  {
    "Id": "statline_518",
    "Name": "High Inquisitor",
    "Type": "Statline",
    "Attributes": {
      "M": "4",
      "WS": "4",
      "BS": "3",
      "S": "4",
      "T": "4",
      "W": "3",
      "I": "4",
      "A": "2",
      "LD": "9"
    }
  },
  {
    "Id": "statline_519",
    "Name": "Santiago de Vivar",
    "Type": "Statline",
    "Attributes": {
      "M": "4",
      "WS": "7",
      "BS": "5",
      "S": "4",
      "T": "4",
      "W": "3",
      "I": "6",
      "A": "5",
      "LD": "9"
    }
  },
  {
    "Id": "statline_520",
    "Name": "Babieca",
    "Type": "Statline",
    "Attributes": {
      "M": "8",
      "WS": "3",
      "BS": "",
      "S": "3",
      "T": "3",
      "W": "1",
      "I": "3",
      "A": "1",
      "LD": "5"
    }
  },
  {
    "Id": "statline_521",
    "Name": "Diestro",
    "Type": "Statline",
    "Attributes": {
      "M": "4",
      "WS": "6",
      "BS": "5",
      "S": "4",
      "T": "4",
      "W": "2",
      "I": "6",
      "A": "3",
      "LD": "8"
    }
  },
  {
    "Id": "statline_522",
    "Name": "Inquisitor",
    "Type": "Statline",
    "Attributes": {
      "M": "4",
      "WS": "4",
      "BS": "3",
      "S": "4",
      "T": "4",
      "W": "2",
      "I": "4",
      "A": "2",
      "LD": "8"
    }
  },
  {
    "Id": "statline_523",
    "Name": "Battle Magus",
    "Type": "Statline",
    "Attributes": {
      "M": "4",
      "WS": "3",
      "BS": "3",
      "S": "3",
      "T": "3",
      "W": "2",
      "I": "3",
      "A": "1",
      "LD": "7"
    }
  },
  {
    "Id": "statline_524",
    "Name": "Priestess of Myrmidia",
    "Type": "Statline",
    "Attributes": {
      "M": "4",
      "WS": "4",
      "BS": "3",
      "S": "4",
      "T": "4",
      "W": "2",
      "I": "4",
      "A": "2",
      "LD": "8"
    }
  },
  {
    "Id": "statline_525",
    "Name": "Altar",
    "Type": "Statline",
    "Attributes": {
      "M": null,
      "WS": null,
      "BS": null,
      "S": null,
      "T": "5",
      "W": "5",
      "I": null,
      "A": null,
      "LD": null
    }
  },
  {
    "Id": "statline_526",
    "Name": "Maria de Salvo",
    "Type": "Statline",
    "Attributes": {
      "M": "4",
      "WS": "7",
      "BS": "5",
      "S": "4",
      "T": "3",
      "W": "2",
      "I": "7",
      "A": "3",
      "LD": "9"
    }
  },
  {
    "Id": "statline_527",
    "Name": "Almogavar",
    "Type": "Statline",
    "Attributes": {
      "M": "4",
      "WS": "3",
      "BS": "3",
      "S": "3",
      "T": "3",
      "W": "1",
      "I": "3",
      "A": "1",
      "LD": "7"
    }
  },
  {
    "Id": "statline_528",
    "Name": "Arquebusier",
    "Type": "Statline",
    "Attributes": {
      "M": "4",
      "WS": "3",
      "BS": "3",
      "S": "3",
      "T": "3",
      "W": "1",
      "I": "3",
      "A": "1",
      "LD": "7"
    }
  },
  {
    "Id": "statline_529",
    "Name": "Caballero",
    "Type": "Statline",
    "Attributes": {
      "M": "4",
      "WS": "4",
      "BS": "3",
      "S": "3",
      "T": "3",
      "W": "1",
      "I": "3",
      "A": "1",
      "LD": "8"
    }
  },
  {
    "Id": "statline_530",
    "Name": "Conquistador",
    "Type": "Statline",
    "Attributes": {
      "M": "4",
      "WS": "4",
      "BS": "4",
      "S": "3",
      "T": "3",
      "W": "1",
      "I": "3",
      "A": "1",
      "LD": "8"
    }
  },
  {
    "Id": "statline_531",
    "Name": "Genitor",
    "Type": "Statline",
    "Attributes": {
      "M": "4",
      "WS": "3",
      "BS": "3",
      "S": "3",
      "T": "3",
      "W": "1",
      "I": "3",
      "A": "1",
      "LD": "7"
    }
  },
  {
    "Id": "statline_532",
    "Name": "Marine",
    "Type": "Statline",
    "Attributes": {
      "M": "4",
      "WS": "3",
      "BS": "3",
      "S": "3",
      "T": "3",
      "W": "1",
      "I": "3",
      "A": "1",
      "LD": "7"
    }
  },
  {
    "Id": "statline_533",
    "Name": "Rodelero",
    "Type": "Statline",
    "Attributes": {
      "M": "4",
      "WS": "4",
      "BS": "3",
      "S": "3",
      "T": "3",
      "W": "1",
      "I": "4",
      "A": "1",
      "LD": "7"
    }
  },
  {
    "Id": "statline_534",
    "Name": "Tercio",
    "Type": "Statline",
    "Attributes": {
      "M": "4",
      "WS": "4",
      "BS": "3",
      "S": "3",
      "T": "3",
      "W": "1",
      "I": "4",
      "A": "1",
      "LD": "7"
    }
  },
  {
    "Id": "statline_535",
    "Name": "War Dog",
    "Type": "Statline",
    "Attributes": {
      "M": "7",
      "WS": "3",
      "BS": "",
      "S": "3",
      "T": "3",
      "W": "1",
      "I": "3",
      "A": "1",
      "LD": "5"
    }
  },
  {
    "Id": "statline_536",
    "Name": "Falconet",
    "Type": "Statline",
    "Attributes": {
      "M": "",
      "WS": "",
      "BS": "",
      "S": "",
      "T": "7",
      "W": "",
      "I": "",
      "A": "",
      "LD": ""
    }
  },
  {
    "Id": "statline_537",
    "Name": "Grenadier",
    "Type": "Statline",
    "Attributes": {
      "M": "4",
      "WS": "3",
      "BS": "3",
      "S": "3",
      "T": "3",
      "W": "1",
      "I": "3",
      "A": "1",
      "LD": "7"
    }
  },
  {
    "Id": "statline_538",
    "Name": "Mountain Bandit",
    "Type": "Statline",
    "Attributes": {
      "M": "4",
      "WS": "3",
      "BS": "3",
      "S": "3",
      "T": "3",
      "W": "1",
      "I": "3",
      "A": "1",
      "LD": "7"
    }
  },
  {
    "Id": "statline_539",
    "Name": "Royal Guard",
    "Type": "Statline",
    "Attributes": {
      "M": "4",
      "WS": "4",
      "BS": "4",
      "S": "3",
      "T": "3",
      "W": "1",
      "I": "4",
      "A": "1",
      "LD": "8"
    }
  },
  {
    "Id": "statline_540",
    "Name": "Sister of Fury",
    "Type": "Statline",
    "Attributes": {
      "M": "4",
      "WS": "4",
      "BS": "4",
      "S": "3",
      "T": "3",
      "W": "1",
      "I": "4",
      "A": "1",
      "LD": "8"
    }
  },
  {
    "Id": "statline_541",
    "Name": "Watchman",
    "Type": "Statline",
    "Attributes": {
      "M": "4",
      "WS": "4",
      "BS": "3",
      "S": "4",
      "T": "3",
      "W": "1",
      "I": "4",
      "A": "1",
      "LD": "8"
    }
  },
  {
    "Id": "statline_542",
    "Name": "Culverin",
    "Type": "Statline",
    "Attributes": {
      "M": "",
      "WS": "",
      "BS": "",
      "S": "",
      "T": "7",
      "W": "",
      "I": "",
      "A": "",
      "LD": ""
    }
  },
  {
    "Id": "statline_543",
    "Name": "Fire Bull",
    "Type": "Statline",
    "Attributes": {
      "M": "7",
      "WS": "3",
      "BS": "",
      "S": "4",
      "T": "4",
      "W": "1",
      "I": "3",
      "A": "1",
      "LD": "5"
    }
  },
  {
    "Id": "statline_544",
    "Name": "Knight of the Raging Bull",
    "Type": "Statline",
    "Attributes": {
      "M": "4",
      "WS": "4",
      "BS": "3",
      "S": "3",
      "T": "3",
      "W": "1",
      "I": "3",
      "A": "1",
      "LD": "8"
    }
  },
  {
    "Id": "statline_545",
    "Name": "Auroch",
    "Type": "Statline",
    "Attributes": {
      "M": "7",
      "WS": "3",
      "BS": "",
      "S": "5",
      "T": "4",
      "W": "3",
      "I": "3",
      "A": "3",
      "LD": "6"
    }
  },
  {
    "Id": "statline_546",
    "Name": "Lombard",
    "Type": "Statline",
    "Attributes": {
      "M": "",
      "WS": "",
      "BS": "",
      "S": "",
      "T": "7",
      "W": "",
      "I": "",
      "A": "",
      "LD": ""
    }
  }
]