[
  {
    "Id": "statline_610",
    "Name": "Moot Elder",
    "Type": "Statline",
    "Attributes": {
      "M": "4",
      "WS": "5",
      "BS": "6",
      "S": "3",
      "T": "3",
      "W": "3",
      "I": "7",
      "A": "4",
      "LD": "10"
    }
  },
  {
    "Id": "statline_611",
    "Name": "Farm Animal",
    "Type": "Statline",
    "Attributes": {
      "M": "7",
      "WS": "2",
      "BS": null,
      "S": "3",
      "T": "3",
      "W": "1",
      "I": "3",
      "A": "1",
      "LD": "3"
    }
  },
  {
    "Id": "statline_612",
    "Name": "Giant Swan",
    "Type": "Statline",
    "Attributes": {
      "M": "2",
      "WS": "3",
      "BS": null,
      "S": "3",
      "T": "3",
      "W": "1",
      "I": "4",
      "A": "1",
      "LD": "5"
    }
  },
  {
    "Id": "statline_613",
    "Name": "Ogre Bodyguard",
    "Type": "Statline",
    "Attributes": {
      "M": "6",
      "WS": "3",
      "BS": null,
      "S": "4",
      "T": "4",
      "W": "1",
      "I": "2",
      "A": "4",
      "LD": "7"
    }
  },
  {
    "Id": "statline_614",
    "Name": "Nicholas Warfoot",
    "Type": "Statline",
    "Attributes": {
      "M": "4",
      "WS": "6",
      "BS": "7",
      "S": "3",
      "T": "3",
      "W": "3",
      "I": "7",
      "A": "4",
      "LD": "10"
    }
  },
  {
    "Id": "statline_615",
    "Name": "Herbalist",
    "Type": "Statline",
    "Attributes": {
      "M": "4",
      "WS": "2",
      "BS": "4",
      "S": "2",
      "T": "2",
      "W": "2",
      "I": "5",
      "A": "1",
      "LD": "8"
    }
  },
  {
    "Id": "statline_616",
    "Name": "Master Chef",
    "Type": "Statline",
    "Attributes": {
      "M": "4",
      "WS": "3",
      "BS": "4",
      "S": "3",
      "T": "3",
      "W": "2",
      "I": "6",
      "A": "2",
      "LD": "9"
    }
  },
  {
    "Id": "statline_617",
    "Name": "Chuck Wagon",
    "Type": "Statline",
    "Attributes": {
      "M": "7",
      "WS": null,
      "BS": null,
      "S": "4",
      "T": "4",
      "W": "3",
      "I": null,
      "A": null,
      "LD": null
    }
  },
  {
    "Id": "statline_618",
    "Name": "Cook",
    "Type": "Statline",
    "Attributes": {
      "M": null,
      "WS": "2",
      "BS": "4",
      "S": "2",
      "T": null,
      "W": null,
      "I": "5",
      "A": "1",
      "LD": "8"
    }
  },
  {
    "Id": "statline_619",
    "Name": "Master Thief",
    "Type": "Statline",
    "Attributes": {
      "M": "4",
      "WS": "4",
      "BS": "6",
      "S": "3",
      "T": "3",
      "W": "2",
      "I": "8",
      "A": "3",
      "LD": "9"
    }
  },
  {
    "Id": "statline_620",
    "Name": "Sheriff",
    "Type": "Statline",
    "Attributes": {
      "M": "4",
      "WS": "4",
      "BS": "6",
      "S": "3",
      "T": "3",
      "W": "2",
      "I": "7",
      "A": "3",
      "LD": "9"
    }
  },
  {
    "Id": "statline_621",
    "Name": "Ogglethorpe Bulnhelm",
    "Type": "Statline",
    "Attributes": {
      "M": "4",
      "WS": "4",
      "BS": "4",
      "S": "3",
      "T": "3",
      "W": "2",
      "I": "6",
      "A": "2",
      "LD": "9"
    }
  },
  {
    "Id": "statline_622",
    "Name": "Fieldwarden",
    "Type": "Statline",
    "Attributes": {
      "M": "4",
      "WS": "2",
      "BS": "4",
      "S": "2",
      "T": "2",
      "W": "1",
      "I": "5",
      "A": "1",
      "LD": "8"
    }
  },
  {
    "Id": "statline_623",
    "Name": "Hobilar",
    "Type": "Statline",
    "Attributes": {
      "M": "4",
      "WS": "2",
      "BS": "4",
      "S": "2",
      "T": "2",
      "W": "1",
      "I": "5",
      "A": "1",
      "LD": "8"
    }
  },
  {
    "Id": "statline_624",
    "Name": "Farm Animal",
    "Type": "Statline",
    "Attributes": {
      "M": "7",
      "WS": "2",
      "BS": "",
      "S": "3",
      "T": "3",
      "W": "1",
      "I": "3",
      "A": "1",
      "LD": "3"
    }
  },
  {
    "Id": "statline_625",
    "Name": "Archer",
    "Type": "Statline",
    "Attributes": {
      "M": "4",
      "WS": "2",
      "BS": "4",
      "S": "2",
      "T": "2",
      "W": "1",
      "I": "5",
      "A": "1",
      "LD": "8"
    }
  },
  {
    "Id": "statline_626",
    "Name": "Spearman",
    "Type": "Statline",
    "Attributes": {
      "M": "4",
      "WS": "2",
      "BS": "4",
      "S": "2",
      "T": "2",
      "W": "1",
      "I": "5",
      "A": "1",
      "LD": "8"
    }
  },
  {
    "Id": "statline_627",
    "Name": "Swordsman",
    "Type": "Statline",
    "Attributes": {
      "M": "4",
      "WS": "2",
      "BS": "4",
      "S": "2",
      "T": "2",
      "W": "1",
      "I": "5",
      "A": "1",
      "LD": "8"
    }
  },
  {
    "Id": "statline_628",
    "Name": "Beekeeper",
    "Type": "Statline",
    "Attributes": {
      "M": "4",
      "WS": "2",
      "BS": "4",
      "S": "2",
      "T": "2",
      "W": "1",
      "I": "5",
      "A": "1",
      "LD": "8"
    }
  },
  {
    "Id": "statline_629",
    "Name": "Deputy",
    "Type": "Statline",
    "Attributes": {
      "M": "4",
      "WS": "3",
      "BS": "4",
      "S": "2",
      "T": "2",
      "W": "1",
      "I": "5",
      "A": "1",
      "LD": "8"
    }
  },
  {
    "Id": "statline_630",
    "Name": "Gamekeeper",
    "Type": "Statline",
    "Attributes": {
      "M": "4",
      "WS": "3",
      "BS": "5",
      "S": "2",
      "T": "2",
      "W": "1",
      "I": "5",
      "A": "1",
      "LD": "8"
    }
  },
  {
    "Id": "statline_631",
    "Name": "Housewife",
    "Type": "Statline",
    "Attributes": {
      "M": "4",
      "WS": "2",
      "BS": "4",
      "S": "2",
      "T": "3",
      "W": "1",
      "I": "5",
      "A": "1",
      "LD": "8"
    }
  },
  {
    "Id": "statline_632",
    "Name": "Reaper",
    "Type": "Statline",
    "Attributes": {
      "M": "7",
      "WS": "",
      "BS": "",
      "S": "5",
      "T": "4",
      "W": "3",
      "I": "",
      "A": "",
      "LD": ""
    }
  },
  {
    "Id": "statline_633",
    "Name": "Farmer",
    "Type": "Statline",
    "Attributes": {
      "M": "",
      "WS": "2",
      "BS": "4",
      "S": "2",
      "T": "",
      "W": "",
      "I": "5",
      "A": "1",
      "LD": "8"
    }
  },
  {
    "Id": "statline_634",
    "Name": "Swan Rider",
    "Type": "Statline",
    "Attributes": {
      "M": "4",
      "WS": "2",
      "BS": "4",
      "S": "2",
      "T": "2",
      "W": "1",
      "I": "6",
      "A": "1",
      "LD": "8"
    }
  },
  {
    "Id": "statline_635",
    "Name": "Giant Swan",
    "Type": "Statline",
    "Attributes": {
      "M": "2",
      "WS": "3",
      "BS": "",
      "S": "3",
      "T": "3",
      "W": "1",
      "I": "4",
      "A": "1",
      "LD": "5"
    }
  },
  {
    "Id": "statline_636",
    "Name": "Thief",
    "Type": "Statline",
    "Attributes": {
      "M": "5",
      "WS": "3",
      "BS": "4",
      "S": "2",
      "T": "2",
      "W": "1",
      "I": "6",
      "A": "1",
      "LD": "8"
    }
  },
  {
    "Id": "statline_637",
    "Name": "Half Tank",
    "Type": "Statline",
    "Attributes": {
      "M": "",
      "WS": "",
      "BS": "",
      "S": "5",
      "T": "6",
      "W": "6",
      "I": "",
      "A": "",
      "LD": ""
    }
  },
  {
    "Id": "statline_638",
    "Name": "Crew",
    "Type": "Statline",
    "Attributes": {
      "M": "4",
      "WS": "2",
      "BS": "4",
      "S": "2",
      "T": "2",
      "W": "1",
      "I": "5",
      "A": "1",
      "LD": "8"
    }
  },
  {
    "Id": "statline_639",
    "Name": "Fireworks Cart",
    "Type": "Statline",
    "Attributes": {
      "M": "",
      "WS": "",
      "BS": "",
      "S": "",
      "T": "5",
      "W": "",
      "I": "",
      "A": "",
      "LD": ""
    }
  },
  {
    "Id": "statline_640",
    "Name": "Treeman",
    "Type": "Statline",
    "Attributes": {
      "M": "6",
      "WS": "3",
      "BS": "2",
      "S": "4",
      "T": "4",
      "W": "3",
      "I": "2",
      "A": "3",
      "LD": "7"
    }
  },
  {
    "Id": "statline_641",
    "Name": "Shearer",
    "Type": "Statline",
    "Attributes": {
      "M": "7",
      "WS": "",
      "BS": "",
      "S": "5",
      "T": "5",
      "W": "4",
      "I": "",
      "A": "",
      "LD": ""
    }
  }
]