[
  {
    "Id": "statline_426",
    "Name": "Yeoman",
    "Type": "Statline",
    "Attributes": {
      "M": "4",
      "WS": "2",
      "BS": "2",
      "S": "3",
      "T": "3",
      "W": "1",
      "I": "2",
      "A": "2",
      "Ld": "6"
    },
    "Children": [
      {
        "Id": "6d4a-7733-d725-a267"
      },
      {
        "Id": "dbb2-4d85-84c2-528c"
      },
      {
        "Id": "e7c7-b48f-7d2c-b337",
        "Info": "(Double-handed)"
      },
      {
        "Id": "985a-110b-3393-79b7",
        "Info": "(Single handed)"
      },
      {
        "Id": "8997-c74d-3a8d-ecf9"
      }
    ]
  },
  {
    "Id": "statline_427",
    "Name": "Yeoman Guard",
    "Type": "Statline",
    "Attributes": {
      "M": "4",
      "WS": "3",
      "BS": "3",
      "S": "3",
      "T": "3",
      "W": "1",
      "I": "3",
      "A": "1",
      "Ld": "6"
    },
    "Children": [
      {
        "Id": "98f8-9d8-94cd-3379"
      },
      {
        "Id": "6d4a-7733-d725-a267"
      },
      {
        "Id": "dbb2-4d85-84c2-528c"
      },
      {
        "Id": "8997-c74d-3a8d-ecf9"
      }
    ]
  },
  {
    "Id": "statline_428",
    "Name": "Warden",
    "Type": "Statline",
    "Attributes": {
      "M": "4",
      "WS": "3",
      "BS": "3",
      "S": "3",
      "T": "3",
      "W": "1",
      "I": "3",
      "A": "2",
      "Ld": "6"
    },
    "Children": [
      {
        "Id": "5f1c-fd04-b0d5-d5e"
      },
      {
        "Id": "98f8-9d8-94cd-3379"
      },
      {
        "Id": "6d4a-7733-d725-a267"
      },
      {
        "Id": "dbb2-4d85-84c2-528c"
      },
      {
        "Id": "8997-c74d-3a8d-ecf9"
      }
    ]
  },
  {
    "Id": "statline_429",
    "Name": "Grail Monk",
    "Type": "Statline",
    "Attributes": {
      "M": "4",
      "WS": "3",
      "BS": "2",
      "S": "3",
      "T": "3",
      "W": "1",
      "I": "2",
      "A": "2",
      "Ld": "6"
    },
    "Children": [
      {
        "Id": "6d4a-7733-d725-a267"
      },
      {
        "Id": "dbb2-4d85-84c2-528c"
      },
      {
        "Id": "8997-c74d-3a8d-ecf9"
      }
    ]
  },
  {
    "Id": "statline_430",
    "Name": "Bombard",
    "Type": "Statline",
    "Attributes": {
      "M": "-",
      "WS": "-",
      "BS": "-",
      "S": "-",
      "T": "7",
      "W": "3",
      "I": "-",
      "A": "-",
      "Ld": "-"
    },
    "Children": [
      {
        "Id": "2746-8b42-242b-8634"
      }
    ]
  },
  {
    "Id": "statline_431",
    "Name": "Brigand",
    "Type": "Statline",
    "Attributes": {
      "M": "4",
      "WS": "3",
      "BS": "3",
      "S": "3",
      "T": "3",
      "W": "1",
      "I": "3",
      "A": "1",
      "Ld": "6"
    },
    "Children": [
      {
        "Id": "6d4a-7733-d725-a267"
      },
      {
        "Id": "dbb2-4d85-84c2-528c"
      }
    ]
  },
  {
    "Id": "statlines_1780229077863",
    "Name": "Crew",
    "Type": "Statline",
    "Attributes": {
      "M": "4",
      "WS": "3",
      "BS": "3",
      "S": "3",
      "T": "3",
      "W": "3",
      "I": "3",
      "A": "3",
      "LD": "7"
    }
  }
]